{
  "version": "1.0",
  "timestamp": "2020-04-28T12:00:00.000Z",
  "requestContext": {
    "requestId": "a1b2c3d4-e5f6-7890-abcd-ef1234567890",
    "functionArn": "arn:aws:lambda:us-east-1:123456789012:function:MyFunction",
    "condition": "RetriesExhausted",
    "approximateInvokeCount": 2
  },
  "requestPayload": {
    "key": "value"
  },
  "responseContext": null,
  "responsePayload": null
}